route_id,route_long_name
94,"Zürich, Aubrücke to Zürich, Dreispitz"
94,"Zürich, Schürgistrasse to Zürich, Aubrücke"
94,"Zürich, Dreispitz to Zürich, Saatlenstrasse"
94,"Zürich, Hallenbad Oerlikon to Zürich, Messe/Hallenstadion"
94,"Zürich, Riedgraben to Zürich, Hallenbad Oerlikon"
94,"Zürich, Messe/Hallenstadion to Zürich, Sternen Oerlikon"
94,"Zürich, Sternen Oerlikon to Zürich, Bahnhof Oerlikon"
95,"Zürich, Flurstrasse to Zürich, Kappeli"
95,"Zürich, Bahnhof Altstetten to Zürich, Bristenstrasse"
95,"Zürich, Kappeli to Zürich, Flurstrasse"
95,"Zürich, Baslerstrasse to Zürich, Letzipark West"
95,"Zürich, Bristenstrasse to Zürich, Baslerstrasse"
95,"Zürich, Letzipark West to Zürich, Kappeli"
95,"Zürich, Albisrank to Zürich, Siemens"
95,"Zürich, Flurstrasse to Zürich, Albisrank"
95,"Zürich, Siemens to Zürich, Freilagerstrasse"
95,"Zürich, Freilagerstrasse to Zürich, Flurstrasse"
95,"Zürich, Letzipark West to Zürich, Luggwegstrasse"
95,"Zürich, Kappeli to Zürich, Letzipark West"
95,"Zürich, Luggwegstrasse to Zürich, Bahnhof Altstetten"
35,"Zürich, Neeserweg to Zürich, Farbhof"
35,"Zürich, Am Suteracher to Zürich, Feusisbergli"
35,"Zürich, Loogarten to Zürich, Am Suteracher"
35,"Zürich, Feusisbergli to Zürich, Neeserweg"
35,"Zürich, Lindenplatz to Zürich, Solidapark"
35,"Zürich, Farbhof to Zürich, Lindenplatz"
35,"Zürich, Friedhof Eichbühl to Zürich, Schulhaus Buchlern"
35,"Zürich, Salzweg to Zürich, Dunkelhölzli"
35,"Zürich, Rautihalde to Zürich, Salzweg"
38,"Zürich, Michelstrasse to Zürich, Friedhof Hönggerberg"
38,"Zürich, Michelstrasse to Zürich, Wieslergasse"
38,"Zürich, Schützenhaus Höngg to Zürich, Friedhof Hönggerberg"
38,"Zürich, Friedhof Hönggerberg to Zürich, Michelstrasse"
38,"Zürich, Waidspital to Zürich, Pflegezentr. Käferberg"
38,"Zürich, Schwert to Zürich, Am Börtli"
38,"Zürich, Kappenbühlweg to Zürich, Meierhofplatz"
38,"Zürich, Wieslergasse to Zürich, Kappenbühlweg"
38,"Zürich, Meierhofplatz to Zürich, Schwert"
38,"Zürich, Appenzellerstrasse to Zürich, Waidbadstrasse"
38,"Zürich, Am Börtli to Zürich, Appenzellerstrasse"
38,"Zürich, Waidbadstrasse to Zürich, Pflegezentr. Käferberg"
38,"Zürich, Pflegezentr. Käferberg to Zürich, Waidspital"
38,"Zürich, Am Börtli to Zürich, Schwert"
38,"Zürich, Waidbadstrasse to Zürich, Appenzellerstrasse"
38,"Zürich, Pflegezentr. Käferberg to Zürich, Waidbadstrasse"
38,"Zürich, Appenzellerstrasse to Zürich, Am Börtli"
38,"Zürich, Meierhofplatz to Zürich, Kappenbühlweg"
38,"Zürich, Schwert to Zürich, Meierhofplatz"
38,"Zürich, Kappenbühlweg to Zürich, Wieslergasse"
38,"Zürich, Wieslergasse to Zürich, Michelstrasse"
38,"Zürich, Friedhof Hönggerberg to Zürich, Schützenhaus Höngg"
39,
39,
39,
39,
39,
39,
39,
39,
39,
39,
39,
39,
39,
39,
39,
39,
39,
39,
39,
39,
39,
39,
39,
40,"Zürich, Krematorium Nordheim to Zürich, Maienweg"
40,"Zürich, Glaubtenstrasse to Zürich, Althoos"
40,"Zürich, Nordheimstrasse to Zürich, Berufswahlschule"
40,"Zürich, Maienweg to Zürich, Krematorium Nordheim"
40,"Zürich, Althoos to Zürich, Maienweg"
40,"Zürich, Krematorium Nordheim to Zürich, Nordheimstrasse"
40,"Zürich, Radiostudio to Zürich, Bucheggplatz"
40,"Zürich, Berufswahlschule to Zürich, Radiostudio"
40,"Zürich, Bucheggplatz to Zürich, Nordheimstrasse"
40,"Zürich, Nordheimstrasse to Zürich, Krematorium Nordheim"
40,"Zürich, Althoos to Zürich, Glaubtenstrasse"
40,"Zürich, Maienweg to Zürich, Althoos"
40,"Zürich, Glaubtenstrasse to Zürich, Glaubtenstrasse"
64,"Zürich, Stierenried to Zürich, Maillartstrasse"
64,"Zürich, Bahnhof Oerlikon Nord to Zürich, Max-Bill-Platz"
64,"Zürich, Bollingerweg to Zürich, Neunbrunnen"
64,"Zürich, Max-Bill-Platz to Zürich, Bollingerweg"
64,"Zürich, Neunbrunnen to Zürich, Stierenried"
64,"Zürich, Bollingerweg to Zürich, Max-Bill-Platz"
64,"Zürich, Stierenried to Zürich, Neunbrunnen"
64,"Zürich, Maillartstrasse to Zürich, Stierenried"
64,"Zürich, Neunbrunnen to Zürich, Bollingerweg"
64,"Zürich, Max-Bill-Platz to Zürich, Bahnhof Oerlikon Nord"
73,"Zürich, Schweighof to Zürich, Friesenbergstrasse"
73,
73,
73,
73,"Zürich, Friesenbergstrasse to Zürich, Schweighof"
73,
73,
73,
79,"Zürich, Herzogenmühlestrasse to Zürich, Schwamendingerplatz"
79,"Zürich, Auzelg to Zürich, Orionstrasse"
79,"Zürich, Auzelg Ost to Zürich, Auzelg"
79,"Zürich, Orionstrasse to Zürich, Aubrücke"
79,"Zürich, Aubrücke to Zürich, Herzogenmühlestrasse"
79,"Zürich, Herzogenmühlestrasse to Zürich, Aubrücke"
79,"Zürich, Friedrichstrasse to Zürich, Bocklerstrasse"
79,"Zürich, Schwamendingerplatz to Zürich, Friedrichstrasse"
79,"Zürich, Schwamendingerplatz to Zürich, Herzogenmühlestrasse"
79,"Zürich, Orionstrasse to Zürich, Auzelg"
79,"Zürich, Aubrücke to Zürich, Orionstrasse"
79,"Zürich, Auzelg to Zürich, Auzelg Ost"
79,"Zürich, Bocklerstrasse to Zürich, Schwamendingerplatz"
161,"Zürich, Bhf Wollishofen (Bus) to Zürich, Landiwiese"
161,"Zürich, Stadtgrenze to Kilchberg ZH, Weinbergstrasse"
161,"Zürich, Schweizer Rück to Zürich, Sukkulentensammlung"
161,"Zürich, Bürkliplatz to Zürich, Rentenanstalt"
161,"Zürich, Rentenanstalt to Zürich, Schweizer Rück"
161,"Zürich, Landiwiese to Zürich, Bhf Wollishofen (Bus)"
161,"Zürich, Sukkulentensammlung to Zürich, Landiwiese"
161,"Zürich, Rote Fabrik to Zürich, Seerose"
161,"Zürich, Seerose to Zürich, Stadtgrenze"
161,"Kilchberg ZH, Auf Brunnen to Kilchberg ZH, Schwelle"
161,"Kilchberg ZH, Sanatorium to Kilchberg ZH, Kreuzstrasse"
161,"Kilchberg ZH, Hornhaldenstr. to Kilchberg ZH, Paradiessteig"
161,"Kilchberg ZH, Weinbergstrasse to Kilchberg ZH, Hornhaldenstr."
161,"Kilchberg ZH, Paradiessteig to Kilchberg ZH, Sanatorium"
161,"Kilchberg ZH, Schwelle to Kilchberg ZH, Auf Brunnen"
161,"Kilchberg ZH, Kreuzstrasse to Kilchberg ZH, Schwelle"
161,"Kilchberg ZH, Auf Brunnen to Kilchberg ZH, Kirche"
161,"Kilchberg ZH, Kirche to Kilchberg ZH, Auf Brunnen"
161,"Kilchberg ZH, Hornhaldenstr. to Kilchberg ZH, Weinbergstrasse"
161,"Kilchberg ZH, Kreuzstrasse to Kilchberg ZH, Sanatorium"
161,"Kilchberg ZH, Schwelle to Kilchberg ZH, Kreuzstrasse"
161,"Kilchberg ZH, Paradiessteig to Kilchberg ZH, Hornhaldenstr."
161,"Zürich, Stadtgrenze to Zürich, Seerose"
161,"Kilchberg ZH, Weinbergstrasse to Zürich, Stadtgrenze"
161,"Zürich, Seerose to Zürich, Rote Fabrik"
161,"Zürich, Rote Fabrik to Zürich, Bhf Wollishofen (Bus)"
161,"Zürich, Rentenanstalt to Zürich, Bürkliplatz"
161,"Zürich, Sukkulentensammlung to Zürich, Schweizer Rück"
161,"Zürich, Landiwiese to Zürich, Sukkulentensammlung"
161,"Zürich, Schweizer Rück to Zürich, Rentenanstalt"
161,"Zürich, Bhf Wollishofen (Bus) to Zürich, Rote Fabrik"
161,"Kilchberg ZH, Sanatorium to Kilchberg ZH, Paradiessteig"
161,"Zürich, Bhf Wollishofen (Bus) to Zürich, Rote Fabrik"
161,"Kilchberg ZH, Sanatorium to Kilchberg ZH, Paradiessteig"
165,"Rüschlikon, Langhaldenstrasse to Rüschlikon, Belvoir"
165,"Zürich, Landiwiese to Zürich, Bhf Wollishofen (Bus)"
165,"Zürich, Rentenanstalt to Zürich, Schweizer Rück"
165,"Zürich, Bürkliplatz to Zürich, Rentenanstalt"
165,"Zürich, Schweizer Rück to Zürich, Sukkulentensammlung"
165,"Kilchberg ZH, Paradiesstrasse to Kilchberg ZH, Bendlikon"
165,"Zürich, Rote Fabrik to Zürich, Seerose"
165,"Zürich, Bhf Wollishofen (Bus) to Zürich, Rote Fabrik"
165,"Zürich, Stadtgrenze to Kilchberg ZH, Paradiesstrasse"
165,"Rüschlikon, Schlossstrasse to Rüschlikon, Bodengasse"
165,"Kilchberg ZH, Bendlikon to Kilchberg ZH, Schooren"
165,"Rüschlikon, Bodengasse to Rüschlikon, Bahnhof"
165,"Rüschlikon, Bahnhof to Rüschlikon, Weidstrasse"
165,"Zürich, Seerose to Zürich, Rote Fabrik"
165,"Rüschlikon, Loorain to Rüschlikon, Säumerstrasse"
165,"Rüschlikon, Loorain to Rüschlikon, Eggrain"
165,"Rüschlikon, Säumerstrasse to Rüschlikon, Loorain"
165,"Rüschlikon, Eggrain to Rüschlikon, Moosstrasse"
165,"Kilchberg ZH, Bendlikon to Kilchberg ZH, Paradiesstrasse"
165,"Rüschlikon, Bahnhof to Rüschlikon, Bodengasse"
165,"Kilchberg ZH, Paradiesstrasse to Zürich, Stadtgrenze"
165,"Zürich, Rentenanstalt to Zürich, Bürkliplatz"
165,"Zürich, Landiwiese to Zürich, Sukkulentensammlung"
165,"Zürich, Rote Fabrik to Zürich, Bhf Wollishofen (Bus)"
165,"Zürich, Schweizer Rück to Zürich, Rentenanstalt"
165,"Rüschlikon, Langhaldenstrasse to Rüschlikon, Weidstrasse"
165,"Rüschlikon, Moosstrasse to Rüschlikon, Eggrain"
165,"Rüschlikon, Moosstrasse to Rüschlikon, Eggrain"
165,"Rüschlikon, Säumerstrasse to Rüschlikon, Belvoir"
165,"Rüschlikon, Eggrain to Rüschlikon, Loorain"
165,"Rüschlikon, Eggrain to Rüschlikon, Loorain"
165,"Rüschlikon, Säumerstrasse to Rüschlikon, Belvoir"
165,"Rüschlikon, Weidstrasse to Rüschlikon, Langhaldenstrasse"
165,"Rüschlikon, Belvoir to Rüschlikon, Langhaldenstrasse"
165,"Rüschlikon, Weidstrasse to Rüschlikon, Langhaldenstrasse"
165,"Rüschlikon, Langhaldenstrasse to Rüschlikon, Weidstrasse"
165,"Zürich, Bhf Wollishofen (Bus) to Zürich, Landiwiese"
165,"Rüschlikon, Schlossstrasse to Kilchberg ZH, Schooren"
165,"Rüschlikon, Bodengasse to Rüschlikon, Schlossstrasse"
165,"Rüschlikon, Weidstrasse to Rüschlikon, Bahnhof"
165,"Rüschlikon, Weidstrasse to Rüschlikon, Bahnhof"
165,"Rüschlikon, Bodengasse to Rüschlikon, Schlossstrasse"
165,"Kilchberg ZH, Schooren to Rüschlikon, Schlossstrasse"
165,"Rüschlikon, Bodengasse to Rüschlikon, Schlossstrasse"
165,"Kilchberg ZH, Schooren to Rüschlikon, Schlossstrasse"
165,"Zürich, Seerose to Zürich, Stadtgrenze"
165,"Kilchberg ZH, Schooren to Kilchberg ZH, Bendlikon"
165,"Rüschlikon, Schlossstrasse to Kilchberg ZH, Schooren"
165,"Kilchberg ZH, Schooren to Kilchberg ZH, Bendlikon"
165,"Zürich, Stadtgrenze to Zürich, Seerose"
165,"Zürich, Seerose to Zürich, Stadtgrenze"
165,"Zürich, Stadtgrenze to Zürich, Seerose"
165,"Zürich, Bhf Wollishofen (Bus) to Zürich, Landiwiese"
165,"Rüschlikon, Belvoir to Rüschlikon, Langhaldenstrasse"
165,"Zürich, Sukkulentensammlung to Zürich, Landiwiese"
165,"Zürich, Sukkulentensammlung to Zürich, Landiwiese"
165,"Zürich, Bhf Wollishofen (Bus) to Zürich, Landiwiese"
165,"Zürich, Sukkulentensammlung to Zürich, Landiwiese"
165,"Zürich, Sukkulentensammlung to Zürich, Schweizer Rück"
165,"Zürich, Sukkulentensammlung to Zürich, Schweizer Rück"
165,"Zürich, Sukkulentensammlung to Zürich, Schweizer Rück"
165,"Rüschlikon, Belvoir to Rüschlikon, Langhaldenstrasse"
165,"Rüschlikon, Belvoir to Rüschlikon, Säumerstrasse"
165,"Rüschlikon, Belvoir to Rüschlikon, Säumerstrasse"
165,"Rüschlikon, Merisbrunnen to Rüschlikon, Moosstrasse"
165,"Rüschlikon, Merisbrunnen to Rüschlikon, Moosstrasse"
165,"Rüschlikon, Merisbrunnen to Rüschlikon, Merisbrunnen"
304,"Unterengstringen, Langacher to Unterengstringen, Sennenbüel N"
304,"Zürich, Frankental to Oberengstringen, Eggbühl"
304,"Oberengstringen, Lanzrain to Oberengstringen, Zentrum"
304,"Oberengstringen, Eggbühl to Oberengstringen, Lanzrain"
304,"Oberengstringen, Zentrum to Oberengstringen, Paradies"
304,"Dietikon, Bahnhof to Fahrweid, Limmatbrücke"
304,"Fahrweid, Brunaustrasse to Geroldswil, Grindlen"
304,"Fahrweid, Au to Fahrweid, Brunaustrasse"
304,"Geroldswil, Grindlen to Geroldswil, Dorfstrasse"
304,"Weiningen ZH, Schulhaus to Weiningen ZH, Lindenplatz"
304,"Geroldswil, Dorfstrasse to Geroldswil, Welbrig"
304,"Geroldswil, Zentrum to Geroldswil, Dorfstrasse"
304,"Geroldswil, Welbrig to Weiningen ZH, Schulhaus"
304,"Weiningen ZH, Ausserdorf to Unterengstringen, Aegelsee"
304,"Weiningen ZH, Lindenplatz to Weiningen ZH, Ausserdorf"
304,"Unterengstringen, Aegelsee to Unterengstringen, Sennenbüel"
307,
307,
307,"Zürich, Bahnhof Altstetten N to Zürich, Vulkanstrasse"
307,"Zürich, Juchhof to Zürich, Werdhölzli"
307,"Schlieren, Rütistrasse to Schlieren, Industrie Gaswerk"
307,
307,"Schlieren, Industrie Gaswerk to Zürich, Juchhof"
307,"Zürich, Bändliweg to Zürich, Vulkanstrasse"
307,"Zürich, Werdhölzli to Zürich, Bändliweg"
307,"Zürich, Vulkanstrasse to Zürich, Bahnhof Altstetten N"
307,"Zürich, Juchhof to Schlieren, Industrie Gaswerk"
307,"Zürich, Bändliweg to Zürich, Werdhölzli"
307,"Zürich, Vulkanstrasse to Zürich, Bändliweg"
307,"Zürich, Werdhölzli to Zürich, Juchhof"
307,
307,"Schlieren, Industrie Gaswerk to Schlieren, Rütistrasse"
323,"Oberengstringen, Paradies to Unterengstringen, Langacher"
323,"Oberengstringen, Paradies to Oberengstringen, Zentrum"
323,"Unterengstringen, Sennenbüel N to Unterengstringen, Langacher"
323,"Unterengstringen, Langacher to Oberengstringen, Paradies"
323,"Zürich, Bahnhof Altstetten to Zürich, Tüffenwies"
323,"Zürich, Frankental to Zürich, Winzerstrasse Süd"
323,"Oberengstringen, Lanzrain to Oberengstringen, Eggbühl"
323,"Oberengstringen, Zentrum to Oberengstringen, Lanzrain"
323,"Oberengstringen, Eggbühl to Zürich, Frankental"
323,"Zürich, Hohenklingensteig to Zürich, Winzerhalde"
323,"Zürich, Winzerstrasse Süd to Zürich, Hohenklingensteig"
323,"Zürich, Winzerhalde to Zürich, Tüffenwies"
323,"Zürich, Tüffenwies to Zürich, Bahnhof Altstetten"
323,"Zürich, Winzerstrasse Süd to Zürich, Frankental"
323,"Zürich, Winzerhalde to Zürich, Hohenklingensteig"
323,"Zürich, Tüffenwies to Zürich, Winzerhalde"
323,"Zürich, Hohenklingensteig to Zürich, Winzerstrasse Süd"
323,"Oberengstringen, Eggbühl to Oberengstringen, Lanzrain"
323,"Zürich, Frankental to Oberengstringen, Eggbühl"
323,"Oberengstringen, Lanzrain to Oberengstringen, Zentrum"
323,"Oberengstringen, Zentrum to Oberengstringen, Paradies"
323,"Unterengstringen, Langacher to Unterengstringen, Sennenbüel N"
743,"Maur, Aschbach to Fällanden, Jugendherberge"
743,"Maur, Dorf to Maur, Kirche"
743,"Dübendorf, Kirche Wil to Dübendorf, Alterszentrum"
743,"Dübendorf, Sonnental to Dübendorf, Breitibach"
743,"Zürich, Bahnhof Stettbach to Dübendorf, Hoffnung"
743,"Dübendorf, Hoffnung to Dübendorf, Sonnental"
743,"Dübendorf, Wasserfurren to Dübendorf, Högler"
743,"Dübendorf, Breitibach to Dübendorf, Wasserfurren"
743,"Dübendorf, Högler to Dübendorf, Kirche Wil"
743,"Fällanden, Gemeindehaus to Fällanden, Wigarten"
743,"Fällanden, Bruggacher to Fällanden, Zil"
743,"Dübendorf, Alterszentrum to Fällanden, Bruggacher"
743,"Fällanden, Zil to Fällanden, Gemeindehaus"
743,"Fällanden, Neuhus to Fällanden, Jugendherberge"
743,"Fällanden, Wigarten to Fällanden, Neuhus"
743,"Fällanden, Jugendherberge to Maur, Aschbach"
743,"Maur, Aschbach to Maur, Dorf"
743,"Dübendorf, Kirche Wil to Dübendorf, Högler"
743,"Fällanden, Wigarten to Fällanden, Gemeindehaus"
743,"Dübendorf, Alterszentrum to Dübendorf, Kreuzbühl"
743,"Maur, Kirche to Maur, See"
743,"Fällanden, Neuhus to Fällanden, Wigarten"
743,"Fällanden, Zil to Fällanden, Bruggacher"
743,"Fällanden, Gemeindehaus to Fällanden, Zil"
743,"Fällanden, Bruggacher to Dübendorf, Kirche Wil"
743,"Dübendorf, Sonnental to Dübendorf, Hoffnung"
743,"Dübendorf, Wasserfurren to Dübendorf, Breitibach"
743,"Dübendorf, Högler to Dübendorf, Wasserfurren"
743,"Dübendorf, Breitibach to Dübendorf, Sonnental"
743,"Maur, See to Maur, Kirche"
743,"Dübendorf, Hoffnung to Zürich, Bahnhof Stettbach"
743,"Maur, Kirche to Maur, Dorf"
743,"Maur, Dorf to Maur, Aschbach"
743,"Dübendorf, Kreuzbühl to Dübendorf, Kirche Wil"
743,"Fällanden, Jugendherberge to Fällanden, Neuhus"
744,"Dübendorf, Wasserfurren to Dübendorf, Breitibach"
744,"Ebmatingen, Looren to Aesch bei Maur, Im Brünneli"
744,"Dübendorf, Högler to Dübendorf, Kirche Wil"
744,"Dübendorf, Hoffnung to Dübendorf, Sonnental"
744,"Zürich, Bahnhof Stettbach to Dübendorf, Hoffnung"
744,"Dübendorf, Breitibach to Dübendorf, Wasserfurren"
744,"Dübendorf, Sonnental to Dübendorf, Breitibach"
744,"Dübendorf, Wasserfurren to Dübendorf, Högler"
744,"Fällanden, Zil to Fällanden, Eggler"
744,"Dübendorf, Alterszentrum to Fällanden, Bruggacher"
744,"Dübendorf, Kirche Wil to Dübendorf, Alterszentrum"
744,"Fällanden, Bruggacher to Fällanden, Zil"
744,"Fällanden, Schützenhaus to Ebmatingen, Leeacherstrasse"
744,"Fällanden, Eggler to Fällanden, Schützenhaus"
744,"Ebmatingen, Leeacherstrasse to Ebmatingen"
744,"Ebmatingen to Ebmatingen, Looren"
744,"Ebmatingen, Leeacherstrasse to Fällanden, Schützenhaus"
744,"Scheuren, Station to Aesch bei Maur, Zollingerheim"
744,"Aesch bei Maur, Zollingerheim to Scheuren, Station"
744,"Aesch bei Maur, Im Brünneli to Aesch bei Maur, Zollingerheim"
744,"Scheuren, Station to Scheuren, Station"
744,"Aesch bei Maur, Im Brünneli to Ebmatingen, Looren"
744,"Aesch bei Maur, Zollingerheim to Aesch bei Maur, Im Brünneli"
744,"Ebmatingen, Looren to Ebmatingen"
744,"Ebmatingen to Ebmatingen, Leeacherstrasse"
744,"Fällanden, Gemeindehaus to Fällanden, Zil"
744,"Fällanden, Eggler to Fällanden, Wigarten"
744,"Fällanden, Schützenhaus to Fällanden, Eggler"
744,"Fällanden, Wigarten to Fällanden, Gemeindehaus"
744,"Fällanden, Bruggacher to Dübendorf, Kirche Wil"
744,"Fällanden, Zil to Fällanden, Bruggacher"
744,"Dübendorf, Kirche Wil to Dübendorf, Högler"
744,"Dübendorf, Högler to Dübendorf, Wasserfurren"
744,"Dübendorf, Sonnental to Dübendorf, Hoffnung"
744,"Dübendorf, Breitibach to Dübendorf, Sonnental"
744,"Dübendorf, Hoffnung to Zürich, Bahnhof Stettbach"
751,"Zürich, Zoo/Forrenweid to Zürich, Tobelhof"
751,"Gockhausen, Ursprungstrasse to Gockhausen, Dorf"
751,"Zürich, Bahnhof Stettbach to Dübendorf, Hoffnung"
751,"Dübendorf, Sonnental to Dübendorf, Kämmaten"
751,"Dübendorf, Hoffnung to Dübendorf, Sonnental"
751,"Dübendorf, Kämmaten to Gockhausen, Ursprungstrasse"
751,"Zürich, Dreiwiesen to Zürich, Bircher-Benner"
751,"Zürich, Tobelhof to Zürich, Zoo/Forrenweid"
751,"Gockhausen, Dorf to Zürich, Tobelhof"
751,"Zürich, Zoo/Forrenweid to Zürich, Dreiwiesen"
751,"Zürich, Kirche Fluntern to Zürich, Bircher-Benner"
751,"Zürich, Bircher-Benner to Zürich, Kirche Fluntern"
751,"Zürich, Bircher-Benner to Zürich, Dreiwiesen"
751,"Zürich, Dreiwiesen to Zürich, Zoo/Forrenweid"
751,"Dübendorf, Kämmaten to Dübendorf, Hoffnung"
751,"Gockhausen, Dorf to Gockhausen, Ursprungstrasse"
751,"Zürich, Tobelhof to Gockhausen, Dorf"
751,"Gockhausen, Ursprungstrasse to Dübendorf, Kämmaten"
751,"Dübendorf, Hoffnung to Zürich, Bahnhof Stettbach"
301,"Fahrweid, Limmatbrücke to Fahrweid, Au"
301,"Oetwil an der Limmat, Halde to Geroldswil, Schweizäcker"
301,"Oetwil an der Limmat, Post to Oetwil an der Limmat, Oberdorf"
301,"Oetwil an der Limmat, Oberdorf to Oetwil an der Limmat, Halde"
301,"Geroldswil, Grindlen to Fahrweid, Brunaustrasse"
301,"Geroldswil, Zentrum to Geroldswil, Dorfstrasse"
301,"Geroldswil, Schweizäcker to Geroldswil, Zentrum"
301,"Geroldswil, Dorfstrasse to Geroldswil, Grindlen"
301,"Fahrweid, Au to Fahrweid, Limmatbrücke"
301,"Fahrweid, Brunaustrasse to Fahrweid, Au"
301,"Fahrweid, Limmatbrücke to Dietikon, Bahnhof"
301,"Dietikon, Bahnhof to Fahrweid, Limmatbrücke"
301,"Geroldswil, Dorfstrasse to Geroldswil, Zentrum"
301,"Fahrweid, Brunaustrasse to Geroldswil, Grindlen"
301,"Fahrweid, Au to Fahrweid, Brunaustrasse"
301,"Geroldswil, Grindlen to Geroldswil, Dorfstrasse"
301,"Geroldswil, Schweizäcker to Oetwil an der Limmat, Halde"
301,"Geroldswil, Zentrum to Geroldswil, Schweizäcker"
301,"Oetwil an der Limmat, Halde to Oetwil an der Limmat, Post"
302,"Schlieren, Feldstrasse to Schlieren, Talacker-Windegg"
302,"Schlieren, Zentrum/Bahnhof to Schlieren, Kesslerstrasse"
302,"Weiningen ZH, Gemeindehaus to Weiningen ZH, Lindenplatz"
302,"Unterengstringen, Sennenbüel to Unterengstringen, Eckstein"
302,"Weiningen ZH, Ausserdorf to Unterengstringen, Aegelsee"
302,"Weiningen ZH, Lindenplatz to Weiningen ZH, Ausserdorf"
302,"Unterengstringen, Aegelsee to Unterengstringen, Sennenbüel"
302,"Schlieren, Talacker-Windegg to Schlieren, Feldstrasse"
302,"Unterengstringen, Eckstein to Schlieren, Talacker-Windegg"
302,"Schlieren, Feldstrasse to Schlieren, Bahnhof"
302,"Schlieren, Bahnhof to Schlieren, Zentrum/Bahnhof"
302,"Urdorf, Uitikonerstrasse to Urdorf, Spitzacker"
302,"Urdorf, Rainweg to Urdorf, Neumattstrasse"
302,"Schlieren, Spital Limmattal to Urdorf, Feldegg"
302,"Schlieren, Kesslerstrasse to Schlieren, Spital Limmattal"
302,"Urdorf, Feldegg to Urdorf, Rainweg"
302,"Urdorf, Spitzacker to Urdorf, Uitikonerstrasse"
302,"Urdorf, Neumattstrasse to Urdorf, Spitzacker"
302,"Urdorf, Uitikonerstrasse to Urdorf Weihermatt, Bahnhof"
302,"Urdorf Weihermatt, Bahnhof to Urdorf, Uitikonerstrasse"
302,"Urdorf, Feldegg to Schlieren, Spital Limmattal"
302,"Urdorf, Neumattstrasse to Urdorf, Rainweg"
302,"Urdorf, Spitzacker to Urdorf, Neumattstrasse"
302,"Urdorf, Rainweg to Urdorf, Feldegg"
302,"Schlieren, Kesslerstrasse to Schlieren, Zentrum"
302,"Schlieren, Spital Limmattal to Schlieren, Kesslerstrasse"
302,"Schlieren, Zentrum to Schlieren, Bahnhof"
302,"Schlieren, Bahnhof to Schlieren, Feldstrasse"
302,"Weiningen ZH, Aegelsee to Weiningen ZH, Ausserdorf"
302,"Unterengstringen, Eckstein to Unterengstringen, Sennenbüel N"
302,"Schlieren, Talacker-Windegg to Unterengstringen, Eckstein"
302,"Unterengstringen, Sennenbüel N to Weiningen ZH, Aegelsee"
302,"Weiningen ZH, Lindenplatz to Weiningen ZH, Gemeindehaus"
302,"Weiningen ZH, Ausserdorf to Weiningen ZH, Lindenplatz"
303,"Spreitenbach, Ikea to Spreitenbach, Shopping Center"
303,"Dietikon, Gjuchstrasse to Dietikon, Oetwilerstrasse"
303,"Dietikon, Sommerau to Dietikon, Dörfli"
303,"Dietikon, Bahnhof to Dietikon, Sommerau"
303,"Urdorf, Herweg to Urdorf, Luberzen"
303,"Dietikon, Hofacker to Dietikon, Birmensdorferstrasse"
303,"Spreitenbach, Altersheim to Spreitenbach, Shopping Center"
303,"Urdorf, Luberzen to Urdorf, Herweg"
303,"Schlieren, Zentrum/Bahnhof to Schlieren, Kesslerstrasse"
303,"Dietikon, Vorstadt to Dietikon, Oetwilerstrasse"
303,"Dietikon, Bahnhof to Dietikon, Vorstadt"
303,"Dietikon, Oetwilerstrasse to Dietikon, Gjuchstrasse"
303,"Schlieren, Reitmen to Schlieren, Steinacker"
303,"Schlieren, Kesslerstrasse to Schlieren, Reitmen"
303,"Schlieren, Steinacker to Urdorf, Luberzen"
303,"Dietikon, Dörfli to Dietikon, Sommerau"
303,"Dietikon, Birmensdorferstrasse to Dietikon, Hofacker"
303,"Urdorf, Herweg to Dietikon, Birmensdorferstrasse"
303,"Dietikon, Hofacker to Dietikon, Dörfli"
303,"Dietikon, Gjuchstrasse to Spreitenbach, Asp"
303,"Dietikon, Sommerau to Dietikon, Bahnhof"
303,"Spreitenbach, Asp to Spreitenbach, Brüel"
303,"Spreitenbach, Brüel to Spreitenbach, Altersheim"
303,"Schlieren, Mülligen to Schlieren, Gasometerbrücke"
303,"Spreitenbach, Furttalstrasse to Spreitenbach, Interio"
303,"Spreitenbach, Ikea to Spreitenb, Center Spreitenbach"
303,"Spreitenbach, Shopping Center to Spreitenbach, Ikea"
303,"Spreitenb, Center Spreitenbach to Spreitenbach, Furttalstrasse"
303,"Spreitenbach, Breiti to Killwangen, Bahnhof"
303,"Spreitenbach, Interio to Spreitenbach, Breiti"
303,"Zürich, Farbhof to Zürich, Micafil"
303,"Zürich, Micafil to Schlieren, Mülligen"
303,"Schlieren, Wagonsfabrik to Schlieren, Zentrum/Bahnhof"
303,"Schlieren, Gasometerbrücke to Schlieren, Wagonsfabrik"
305,"Bergdietikon, Bergli to Bergdietikon, Bernold"
305,"Dietikon, Bahnhofstrasse to Dietikon, Stadthaus"
305,"Dietikon, Bahnhof to Dietikon, Bahnhofstrasse"
305,"Dietikon, Marmori-Weiher to Bergdietikon, Baltenschwil"
305,"Dietikon, Stadthaus to Dietikon, Marmori-Weiher"
305,"Bergdietikon, Baltenschwil to Bergdietikon, Rietwies"
305,"Bergdietikon, Rietwies to Bergdietikon, Bergli"
305,"Dietikon, Marmori-Weiher to Dietikon, Stadthaus"
305,"Dietikon, Stelzenacker to Dietikon, Marmori-Weiher"
305,"Dietikon, Stadthaus to Dietikon, Oberdorf"
305,"Bergdietikon, Vorbühl to Kindhausen AG, Eichholz"
305,"Bergdietikon, Bernold to Bergdietikon, Vorbühl"
305,"Kindhausen AG, Eichholz to Kindhausen AG"
305,"Dietikon, Hätschen to Dietikon, Staffelackerstrasse"
305,"Dietikon, Oberdorf to Dietikon, Hätschen"
305,"Dietikon, Staffelackerstrasse to Dietikon, Stelzenacker"
305,"Bergdietikon, Bernold to Bergdietikon, Bergli"
305,"Kindhausen AG, Eichholz to Bergdietikon, Vorbühl"
305,"Kindhausen AG to Kindhausen AG, Eichholz"
305,"Bergdietikon, Vorbühl to Bergdietikon, Bernold"
305,"Bergdietikon, Rietwies to Bergdietikon, Baltenschwil"
305,"Bergdietikon, Bergli to Bergdietikon, Rietwies"
305,"Bergdietikon, Baltenschwil to Bergdietikon, Dünni"
305,"Bergdietikon, Dünni to Dietikon, Marmori-Weiher"
305,"Dietikon, Kirchplatz to Dietikon, Bahnhof"
305,"Dietikon, Stadthaus to Dietikon, Kirchplatz"
306,"Dietikon, Stelzenacker to Dietikon, Stadthalle Ost"
306,"Dietikon, Bahnhofstrasse to Dietikon, Stadthaus"
306,"Dietikon, Bahnhof to Dietikon, Bahnhofstrasse"
306,"Dietikon, Oberdorf to Dietikon, Hätschen"
306,"Dietikon, Stadthaus to Dietikon, Oberdorf"
306,"Dietikon, Hätschen to Dietikon, Staffelackerstrasse"
306,"Dietikon, Staffelackerstrasse to Dietikon, Stelzenacker"
306,"Dietikon, Stadthalle Ost to Dietikon, Stelzenacker"
306,"Dietikon, Oberdorf to Dietikon, Stadthaus"
306,"Dietikon, Hätschen to Dietikon, Oberdorf"
306,"Dietikon, Stadthaus to Dietikon, Kirchplatz"
306,"Dietikon, Kirchplatz to Dietikon, Bahnhof"
306,"Dietikon, Stelzenacker to Dietikon, Hätschen"
308,"Unterengstringen, Langacher to Oberengstringen, Paradies"
308,"Oberengstringen, Lanzrain to Oberengstringen, Zentrum"
308,"Zürich, Frankental to Oberengstringen, Eggbühl"
